[
  {
    "decision_index": 0,
    "eligible": true,
    "episode_id": "syn_f03_bell_then_square.clean",
    "family_annotation_version": "synthetic-v1",
    "family_id": "syn_f03_bell_then_square",
    "feasible_route_ids": [
      "route.syn_f03_bell_then_square.ses_syn_f03_bell_then_square_1"
    ],
    "observed_evidence_ids": [],
    "record_id": "feasible.synthetic_validator_a.syn_f03_bell_then_square.clean.0",
    "remaining_cost": 12.0,
    "remaining_steps": 10,
    "restoration_available": false,
    "route_alternatives": [
      {
        "feasible": true,
        "missing_evidence_ids": [
          "s2_bell",
          "s2_red_square"
        ],
        "reason": "direct_route",
        "required_cost": 4.0,
        "required_steps": 3,
        "route_id": "route.syn_f03_bell_then_square.ses_syn_f03_bell_then_square_1",
        "set_id": "ses_syn_f03_bell_then_square_1",
        "steps": [
          {
            "arguments": {
              "include_audio": true,
              "include_video": false,
              "interval": {
                "end_s": 44.0,
                "start_s": 38.0
              }
            },
            "cost": 2.0,
            "expected_evidence_ids": [
              "s2_bell"
            ],
            "tool": "inspect_clip"
          },
          {
            "arguments": {
              "include_audio": false,
              "include_video": true,
              "interval": {
                "end_s": 230.0,
                "start_s": 224.0
              }
            },
            "cost": 2.0,
            "expected_evidence_ids": [
              "s2_red_square"
            ],
            "tool": "inspect_clip"
          },
          {
            "arguments": {
              "target": "supported_answer"
            },
            "cost": 0.0,
            "expected_evidence_ids": [],
            "tool": "finalize"
          }
        ]
      }
    ],
    "schema_version": "1.0.0",
    "source_trajectory_hash": "sha256:cc2629158d28e1d090e6279eed8f1c113176d474ffcf70d16954a9c9f3ef2a37",
    "source_trajectory_id": "traj.validator-synthetic_validator_a.syn_f03_bell_then_square.clean",
    "state_role": "CLEAN",
    "validator_id": "synthetic_validator_a"
  },
  {
    "decision_index": 1,
    "eligible": true,
    "episode_id": "syn_f03_bell_then_square.clean",
    "family_annotation_version": "synthetic-v1",
    "family_id": "syn_f03_bell_then_square",
    "feasible_route_ids": [
      "route.syn_f03_bell_then_square.ses_syn_f03_bell_then_square_1"
    ],
    "observed_evidence_ids": [],
    "record_id": "feasible.synthetic_validator_a.syn_f03_bell_then_square.clean.1",
    "remaining_cost": 11.0,
    "remaining_steps": 9,
    "restoration_available": false,
    "route_alternatives": [
      {
        "feasible": true,
        "missing_evidence_ids": [
          "s2_bell",
          "s2_red_square"
        ],
        "reason": "direct_route",
        "required_cost": 4.0,
        "required_steps": 3,
        "route_id": "route.syn_f03_bell_then_square.ses_syn_f03_bell_then_square_1",
        "set_id": "ses_syn_f03_bell_then_square_1",
        "steps": [
          {
            "arguments": {
              "include_audio": true,
              "include_video": false,
              "interval": {
                "end_s": 44.0,
                "start_s": 38.0
              }
            },
            "cost": 2.0,
            "expected_evidence_ids": [
              "s2_bell"
            ],
            "tool": "inspect_clip"
          },
          {
            "arguments": {
              "include_audio": false,
              "include_video": true,
              "interval": {
                "end_s": 230.0,
                "start_s": 224.0
              }
            },
            "cost": 2.0,
            "expected_evidence_ids": [
              "s2_red_square"
            ],
            "tool": "inspect_clip"
          },
          {
            "arguments": {
              "target": "supported_answer"
            },
            "cost": 0.0,
            "expected_evidence_ids": [],
            "tool": "finalize"
          }
        ]
      }
    ],
    "schema_version": "1.0.0",
    "source_trajectory_hash": "sha256:cc2629158d28e1d090e6279eed8f1c113176d474ffcf70d16954a9c9f3ef2a37",
    "source_trajectory_id": "traj.validator-synthetic_validator_a.syn_f03_bell_then_square.clean",
    "state_role": "CLEAN",
    "validator_id": "synthetic_validator_a"
  },
  {
    "decision_index": 2,
    "eligible": true,
    "episode_id": "syn_f03_bell_then_square.clean",
    "family_annotation_version": "synthetic-v1",
    "family_id": "syn_f03_bell_then_square",
    "feasible_route_ids": [
      "route.syn_f03_bell_then_square.ses_syn_f03_bell_then_square_1"
    ],
    "observed_evidence_ids": [
      "s2_bell"
    ],
    "record_id": "feasible.synthetic_validator_a.syn_f03_bell_then_square.clean.2",
    "remaining_cost": 9.0,
    "remaining_steps": 8,
    "restoration_available": false,
    "route_alternatives": [
      {
        "feasible": true,
        "missing_evidence_ids": [
          "s2_red_square"
        ],
        "reason": "direct_route",
        "required_cost": 2.0,
        "required_steps": 2,
        "route_id": "route.syn_f03_bell_then_square.ses_syn_f03_bell_then_square_1",
        "set_id": "ses_syn_f03_bell_then_square_1",
        "steps": [
          {
            "arguments": {
              "include_audio": false,
              "include_video": true,
              "interval": {
                "end_s": 230.0,
                "start_s": 224.0
              }
            },
            "cost": 2.0,
            "expected_evidence_ids": [
              "s2_red_square"
            ],
            "tool": "inspect_clip"
          },
          {
            "arguments": {
              "target": "supported_answer"
            },
            "cost": 0.0,
            "expected_evidence_ids": [],
            "tool": "finalize"
          }
        ]
      }
    ],
    "schema_version": "1.0.0",
    "source_trajectory_hash": "sha256:cc2629158d28e1d090e6279eed8f1c113176d474ffcf70d16954a9c9f3ef2a37",
    "source_trajectory_id": "traj.validator-synthetic_validator_a.syn_f03_bell_then_square.clean",
    "state_role": "CLEAN",
    "validator_id": "synthetic_validator_a"
  },
  {
    "decision_index": 3,
    "eligible": true,
    "episode_id": "syn_f03_bell_then_square.clean",
    "family_annotation_version": "synthetic-v1",
    "family_id": "syn_f03_bell_then_square",
    "feasible_route_ids": [
      "route.syn_f03_bell_then_square.ses_syn_f03_bell_then_square_1"
    ],
    "observed_evidence_ids": [
      "s2_bell"
    ],
    "record_id": "feasible.synthetic_validator_a.syn_f03_bell_then_square.clean.3",
    "remaining_cost": 8.0,
    "remaining_steps": 7,
    "restoration_available": false,
    "route_alternatives": [
      {
        "feasible": true,
        "missing_evidence_ids": [
          "s2_red_square"
        ],
        "reason": "direct_route",
        "required_cost": 2.0,
        "required_steps": 2,
        "route_id": "route.syn_f03_bell_then_square.ses_syn_f03_bell_then_square_1",
        "set_id": "ses_syn_f03_bell_then_square_1",
        "steps": [
          {
            "arguments": {
              "include_audio": false,
              "include_video": true,
              "interval": {
                "end_s": 230.0,
                "start_s": 224.0
              }
            },
            "cost": 2.0,
            "expected_evidence_ids": [
              "s2_red_square"
            ],
            "tool": "inspect_clip"
          },
          {
            "arguments": {
              "target": "supported_answer"
            },
            "cost": 0.0,
            "expected_evidence_ids": [],
            "tool": "finalize"
          }
        ]
      }
    ],
    "schema_version": "1.0.0",
    "source_trajectory_hash": "sha256:cc2629158d28e1d090e6279eed8f1c113176d474ffcf70d16954a9c9f3ef2a37",
    "source_trajectory_id": "traj.validator-synthetic_validator_a.syn_f03_bell_then_square.clean",
    "state_role": "CLEAN",
    "validator_id": "synthetic_validator_a"
  },
  {
    "decision_index": 4,
    "eligible": false,
    "episode_id": "syn_f03_bell_then_square.clean",
    "family_annotation_version": "synthetic-v1",
    "family_id": "syn_f03_bell_then_square",
    "feasible_route_ids": [],
    "observed_evidence_ids": [
      "s2_bell",
      "s2_red_square"
    ],
    "record_id": "feasible.synthetic_validator_a.syn_f03_bell_then_square.clean.4",
    "remaining_cost": 6.0,
    "remaining_steps": 6,
    "restoration_available": false,
    "route_alternatives": [
      {
        "feasible": false,
        "missing_evidence_ids": [],
        "reason": "evidence_already_sufficient",
        "required_cost": 0,
        "required_steps": 0,
        "route_id": "route.syn_f03_bell_then_square.ses_syn_f03_bell_then_square_1",
        "set_id": "ses_syn_f03_bell_then_square_1",
        "steps": []
      }
    ],
    "schema_version": "1.0.0",
    "source_trajectory_hash": "sha256:cc2629158d28e1d090e6279eed8f1c113176d474ffcf70d16954a9c9f3ef2a37",
    "source_trajectory_id": "traj.validator-synthetic_validator_a.syn_f03_bell_then_square.clean",
    "state_role": "CLEAN",
    "validator_id": "synthetic_validator_a"
  },
  {
    "decision_index": 0,
    "eligible": false,
    "episode_id": "syn_f03_bell_then_square.blocked",
    "family_annotation_version": "synthetic-v1",
    "family_id": "syn_f03_bell_then_square",
    "feasible_route_ids": [],
    "observed_evidence_ids": [],
    "record_id": "feasible.synthetic_validator_a.syn_f03_bell_then_square.blocked.0",
    "remaining_cost": 12.0,
    "remaining_steps": 10,
    "restoration_available": false,
    "route_alternatives": [
      {
        "feasible": false,
        "missing_evidence_ids": [
          "s2_bell",
          "s2_red_square"
        ],
        "reason": "blocked_state_has_no_restoration_operation",